{
  "PurchDate": 1260144000,
  "Auction": "ADESA",
  "VehYear": 2006,
  "VehicleAge": 3,
  "Make": "MAZDA",
  "Model": "MAZDA3",
  "Trim": "i",
  "SubModel": "4D SEDAN I",
  "Color": "RED",
  "Transmission": "AUTO",
  "WheelTypeID": 1.0,
  "WheelType": "Alloy",
  "VehOdo": 89046,
  "Nationality": "OTHER ASIAN",
  "Size": "MEDIUM",
  "TopThreeAmericanName": "OTHER",
  "MMRAcquisitionAuctionAveragePrice": 8155.0,
  "MMRAcquisitionAuctionCleanPrice": 9829.0,
  "MMRAcquisitionRetailAveragePrice": 11636.0,
  "MMRAcquisitonRetailCleanPrice": 13600.0,
  "MMRCurrentAuctionAveragePrice": 7451.0,
  "MMRCurrentAuctionCleanPrice": 8552.0,
  "MMRCurrentRetailAveragePrice": 11597.0,
  "MMRCurrentRetailCleanPrice": 12409.0,
  "PRIMEUNIT": null,
  "AUCGUART": null,
  "BYRNO": 21973,
  "VNZIP1": 33619,
  "VNST": "FL",
  "VehBCost": 7100.0,
  "IsOnlineSale": 0,
  "WarrantyCost": 1113
}